<?xml version="1.0" encoding="UTF-8"?>
<!DOCTYPE dmes SYSTEM "../schemes/dmes.dtd">
<dmes>
	<options>
		<option name="s">hd720</option>
		<option name="b">2M</option>
		<option name="bt">4M</option>
		<option name="vcodec">libx264</option>
		<option name="threads">4</option>
		<option name="ar">48000</option>
		<option name="ab">192k</option>
	</options>
	
	<command>FFMpeg</command>
	
	<post-process>
		<tool>MP4Box</tool>
		<options>
			<option name="hint"></option>
			<option name="mpeg4"></option>
			<option name="inter">500</option>
		</options>
	</post-process>
</dmes>